{
	"header": {
		"licensing": "Creative Commons 4.0",
		"formatVersion": "0.1",
		"formatVersionSpecificationUri": null,
		"reportId": "uuid4-string",
		"reportDatetime": "2023-12-01 08:30:00",
		"reportStatus": "draft|final|corrective",
		"publisher": {
			"name": null,
			"division": null,
			"location": null,
			"projectName": null,
			"confidentialityLevel": "public|internal|confidential|secret",
			"publicKey": "AAAAB3NzaC1yc2EAAAADAQABAAAAgQCSFe5dQLBl+USwot9wrko1tYvipUnXKMDGQuxtghQKbYRVOFMMsIntTqYw6wqRqenHqC3aWUpPdv1JUls9Rf32T5Xqdu+yEshvyGwyo+gHfRynZSF4Qe3wSf8kXYJVLbM0jRDPCKManruppKXr+aqIW8JiD+wfDsvBGhM5ftUKzw=="
		}
	},
	"dataTypes": {
		"tabular": {
			"fileType": "csv",
			"volume": 80,
			"volumeUnit": "kilobyte|megabyte|gigabyte|terabyte",
			"source": "public|private",
			"sourceUri": null,
			"items": 150000,
			"itemsDimension": {
				"1": 60
			} 
		},
		"audio": {
			"fileType": null,
			"volume": 0,
			"volumeUnit": null,
			"source": null,
			"sourceUri": null,
			"items": null,
			"itemsDimension": null
		},
		"image": {
			"fileType": "jpeg",
			"volume": 215,
			"volumeUnit": "kilobyte|megabyte|gigabyte|terabyte",
			"source": "public|private",
			"sourceUri": "https://www.kaggle.com/datasets/imsparsh/flowers-dataset/",
			"items": 4500,
			"itemsDimension": {
				"1": 256,
				"2": 256
			}
		},
		"video": {
			"active": false,
			"fileType": null,
			"volume": 0,
			"volumeUnit": null,
			"source": null,
			"sourceUri": null,
			"items": null,
			"itemsDimension": null
		},
		"object": {
			"active": false,
			"fileType": null,
			"volume": 0,
			"volumeUnit": null,
			"source": null,
			"sourceUri": null,
			"items": null,
			"itemsDimension": null
		}
	},
	"measurementMethod": {
		"software": {
			"CodeCarbon": {
				"solutionFamily": "library",
				"solutionVersion": "2.3.2",
				"measureUnit": "Wh",
				"measureValue": 459	
			},
			"CarbonAI": {
				"solutionVersion": null,
				"measureUnit": null,
				"measureValue": null	
			},
			"PyJoule": {}
		},
		"hardware": {
			"PCE-PA6000": {
				"instrumentFamily": "WattMeter",
				"instrumentManufacturer": "PCE Instruments",
				"eanCode": "4250348701152",
				"measureUnit": "Wh",
				"measureValue": null		
			}
		}
	},
	"taskContext": {
		"taskDomain": "machine-learning|general-software|gaming|...",
		"taskSubDomain": "deep-learning|reinforcement-learning|...",
		"taskType": "preprocessing|clustering|classification|reinforcement|finetuning|inference",
		"taskSubType": "vectorization",
		"algorithms": {
			"ResNet50": {
				"framework": "TensorFlow",
				"frameworkVersion": "2.14.0",
				"classPath": "tf.keras.applications.resnet50.ResNet50",
				"hyperparameters": {
					"key1": "value1"
				},
				"trainPercent": 0.7,
				"validationPercent": 0.3,
				"testPercent": 0.0
			}
		}
	},
	"systemContext": {
		"os": "Linux",
		"distribution": "RedHat",
		"distributionVersion": "Enterprise Linux 9",
		"kernelVersion": null
	},
	"softwareContext": {
		"language": "python",
		"version": "3.11.6"
	},
	"hardwareContext": {
		"shared": true,
		"cpu": {
			"items": 1,
			"manufacturer": "AMD",
			"family": "Ryzen",
			"series": "7000X3D",
			"share": 0.2
		},
		"gpu": {
			"items": 4,
			"manufacturer": "NVIDIA",
			"family": "GeForce",
			"series": "RTX 4090",
			"share": 0.5
		},
		"motherboard": null,
		"drive": null,
		"fans": null,
		"extra": null
	},
	"environment": {
		"country": "France",
		"latitude": null,
		"longitude": null,
		"location": null,
		"powerSupplierType": "public|private|internal",
		"powerSource": "default|solar|wind|nuclear|hydro|gas|coal|other",
		"powerSourceCarbonIntensityUnit": "gCO2eq/kWh",
		"powerSourceCarbonIntensity": 85
	},
	"contentHash": {
		"algorithm": "RSA",
		"value": "7BBAD02FC4C657A2CC858CD4EA2EC751"
	}
}
